username;date;retweets;favorites;text;geo;mentions;hashtags;id;permalink
;2018-07-18 15:32;3;3;". @ singh_sudhir12 shares his point of view on achieving stellar results in Q1 FY’19. https://www.niit-tech.com/news-events/news/niit-technologies-q1fy%E2%80%9919-pat-674 …pic.twitter.com/Q0GTJzHeHV";;@;;"1019545518005981185";https://twitter.com/NIITTech/status/1019545518005981185
;2018-07-18 14:17;2;5;". @ ArvindatNIIT shares his views on Q1 FY’19 results.pic.twitter.com/xTgobNDJUP";;@;;"1019526494731821057";https://twitter.com/NIITTech/status/1019526494731821057
;2018-07-18 14:10;3;3;"Rajendra S. Pawar, Chairman, NIIT Technologies, shares his thoughts on Q1 FY’19 results.pic.twitter.com/RS8fIvTgDn";;;;"1019524754926194689";https://twitter.com/NIITTech/status/1019524754926194689
;2018-07-18 13:36;2;2;"Q1 FY’19 PAT up 67.4%pic.twitter.com/d1UXflVrCY";;;;"1019516286878003201";https://twitter.com/NIITTech/status/1019516286878003201
;2018-07-17 17:30;2;5;"Don't get stuck with stagnated # claimsmanagement in your # insurance business. Reinvent and regrow with # CognitiveComputing. Here's more on it from our expert Vikram Singh: https://goo.gl/KJq1fF pic.twitter.com/8Y3SRtqRk7";;;# # #;"1019212845458784256";https://twitter.com/NIITTech/status/1019212845458784256
;2018-07-16 17:35;1;2;"# DidYouKnow # InstantApps are changing the future of # mobileapp development by providing enhanced # userexperience without the need to install? Read more from our expert Rahul Arora: https://goo.gl/mFLtGA pic.twitter.com/USxTWeVW46";;;# # # #;"1018851541091016704";https://twitter.com/NIITTech/status/1018851541091016704
;2018-07-15 17:30;4;2;"With human-like reasoning, insights, and faster decision-making, # CognitiveComputing makes # insurance # claimsmanagement more effective and profitable. Our expert Vikram Singh elaborates further: https://goo.gl/ha25oG pic.twitter.com/vliHEInU4Y";;;# # #;"1018487942753513474";https://twitter.com/NIITTech/status/1018487942753513474
;2018-07-14 17:30;4;7;"Real value in # insurance # underwrting is now created with the help of # AI, # automation, and # IoT. Our # insuretech expert @ JR_insurance explains how. https://goo.gl/LVt7Ej pic.twitter.com/k48wCmXFCX";;@;# # # # # #;"1018125566883528704";https://twitter.com/NIITTech/status/1018125566883528704
;2018-07-13 17:08;3;8;"# Fintech players can build a more cost-effective # advisorymodel through # digitalization of the # investmentmanagement process. Our # BFS expert @ suvrataa describes how: https://goo.gl/GNePXh pic.twitter.com/xfRjftoQxf";;@;# # # # #;"1017757737625800704";https://twitter.com/NIITTech/status/1017757737625800704
;2018-07-12 17:08;1;2;"Improving financial governance and transparency are at the heart of enhancements sought in future-ready systems. Here’s how we implemented augmented financial system at a leading # FinancialServices firm to enhance its Commercial Banking System (CBS). https://goo.gl/xdyFm3 pic.twitter.com/JdFPJLFfYg";;;#;"1017395373726486528";https://twitter.com/NIITTech/status/1017395373726486528
;2018-07-11 11:04;2;3;"Thank You for joining us at the # NIITTechExecForum. It was a pleasure interacting with you.pic.twitter.com/KNzmgOGTpS";;;#;"1016941166036770816";https://twitter.com/NIITTech/status/1016941166036770816
;2018-07-10 18:01;1;1;"Andrew Koslow and @DarrenDuffyTRWM share their views on the best way forward for the # Wealth and # AssetManagement # industry in the era of # AI and # IntelligentMachines. # NIITTechExecForumpic.twitter.com/iADaVySNEJ";;@DarrenDuffyTRWM;# # # # # #;"1016683864067137537";https://twitter.com/NIITTech/status/1016683864067137537
;2018-07-10 01:01;0;0;"@DarrenDuffyTRWM discusses the best practices in transforming work practices , workflows and processes to successfully harness the power of # AI in Wealth & # AssetManagement . # NIITTechExecForum https://goo.gl/5hQ39y pic.twitter.com/rubtTPrS3c";;@DarrenDuffyTRWM;# # #;"1016427019628933120";https://twitter.com/NIITTech/status/1016427019628933120
;2018-07-09 18:01;0;1;"Andrew Koslow, EVP-Strategic Transaction /General Counsel at Foliofn discusses about the multiple uses of # AI for better and # smarter # investment management . # NIITTechExecForum https://goo.gl/5hQ39y pic.twitter.com/4sM8l5K5CG";;;# # # #;"1016321396643942401";https://twitter.com/NIITTech/status/1016321396643942401
;2018-07-09 09:06;1;2;"Get a unique perspective on successful strategies being leveraged by top IT and business leaders as we discuss how to create a 21st century Wealth and Asset enterprise powered by # AI. # NIITTechExecForum https://goo.gl/5hQ39y pic.twitter.com/cm0HvLVF5D";;;# #;"1016186815966072833";https://twitter.com/NIITTech/status/1016186815966072833
;2018-07-07 18:43;1;5;"Be a part of an interactive executive dinner session as the future of # Wealth & # Assetmanagement, powered by # AI unfolds. Join the discussion on 10th July. # NIITTechExecForum https://goo.gl/5hQ39y pic.twitter.com/4zrviIXT3C";;;# # # #;"1015607280736358400";https://twitter.com/NIITTech/status/1015607280736358400
;2018-07-07 01:00;3;6;"You don't want to miss out on this interactive discussion that will give you a sneak peak into the exciting future of # Wealth and # Asset Management using the power of # AI. # NIITTechExecForum https://goo.gl/5hQ39y pic.twitter.com/ka5DQiqMlV";;;# # # #;"1015339744614604801";https://twitter.com/NIITTech/status/1015339744614604801
;2018-07-06 18:00;1;1;"Make room in your schedule on the 10th of July foran interactive discussion that will explore the endless possibilities of # IntelligentMachines in # Wealth and # Asset Management. # NIITTechExecForum https://goo.gl/5hQ39y pic.twitter.com/oFs49ahYYJ";;;# # # #;"1015234031628292096";https://twitter.com/NIITTech/status/1015234031628292096
;2018-07-05 17:05;3;5;"Power your future with AI. Accelerate and improve the yield on # AI investments by integrating AI into your operations. Join the discussion. # NIITTechExecForum https://goo.gl/5hQ39y pic.twitter.com/61Uptp5neq";;;# #;"1014857768145248257";https://twitter.com/NIITTech/status/1014857768145248257
;2018-07-04 19:03;2;1;"Join us on 10 July, 2018 at 6:30 PM ET as we host Executive Networking Dinner with an open discussion on Harnessing the Power of # AI in # Wealth & # Asset Management. # NIITTechExecForum . See you there! https://goo.gl/5hQ39y pic.twitter.com/Xyp1JULEK3";;;# # # #;"1014525032712712192";https://twitter.com/NIITTech/status/1014525032712712192
;2018-07-04 13:11;6;6;"Young Women NIITians making us proud! 34 enthusiastic women NIITians who graduated from our only Women fresher’s batch making their mark in different technology projects. Catch glimpses from our IMS Graduation ceremonypic.twitter.com/ArKNJX5gJb";;;;"1014436527093571586";https://twitter.com/NIITTech/status/1014436527093571586
;2018-07-03 17:17;3;5;"Manage # Digital convergence with Surety –as-a-Service ( # Saas)! Sureties and brokers can improve workflow management, reduce risk and increase profitability. https://goo.gl/2hQm3g pic.twitter.com/h9DoUV1lKt";;;# #;"1014135931723505664";https://twitter.com/NIITTech/status/1014135931723505664
;2018-07-03 13:30;1;4;"What are the best practices for enhanced # datasecurity for # insurance? https://goo.gl/n5Kudq pic.twitter.com/15KBxRQCYt";;;# #;"1014078997662232579";https://twitter.com/NIITTech/status/1014078997662232579
;2018-07-01 17:30;3;2;"A customer-centric service approach in # insurance is possible with an omni-channel solution that can aggregate customers’ data across multiple channels. Know more: https://goo.gl/1oyuic pic.twitter.com/4kbgVqt6mL";;;#;"1013414485418303491";https://twitter.com/NIITTech/status/1013414485418303491
;2018-06-30 17:30;5;8;"Where Can Technology Make Air Travel More Bearable? Rajendra Pawar, Chairman, NIIT Technologies and @ singh_sudhir12 discuss with @ AVB_ME about how # technologies such as # AI, # ML & # IOT can make # airport experience better for # travelers.https://goo.gl/z5N88Q";;@ @;# # # # # #;"1013052106654277632";https://twitter.com/NIITTech/status/1013052106654277632
;2018-06-29 17:30;4;4;"Migration to an open source delivers a single view of the system and ensures better knowledge sharing across the business? Here’s how we enabled seamless migration of SAP ERP systems for a leading auto parts supplier. https://goo.gl/hkGJ2x # BFSIpic.twitter.com/4LQGSwAhbt";;;#;"1012689710131699712";https://twitter.com/NIITTech/status/1012689710131699712
;2018-06-28 09:45;7;9;"Pleased to share that we are ranked number one in ‘Business Understanding’ by our clients surveyed in the 2018 UK IT Outsourcing Study conducted by Whitelane Research and @ PA_Consulting. https://goo.gl/CkWRah pic.twitter.com/fOYKFIQlrO";;@;;"1012210388849582080";https://twitter.com/NIITTech/status/1012210388849582080
;2018-06-27 18:20;2;3;". @ singh_sudhir12 discusses the impact of @ digitalization on # aviation in an interview @ AVB_ME.https://goo.gl/D3RvHB";;@ @ @;#;"1011977497922166785";https://twitter.com/NIITTech/status/1011977497922166785
;2018-06-26 17:30;4;5;"Millennials are soon going to be the decision-makers of various financial institutions. Here's what the banks need to be prepared for: https://goo.gl/4KsBAu # OnlineBanking # BFSIpic.twitter.com/RiUQoeIL3Y";;;# #;"1011602535789027331";https://twitter.com/NIITTech/status/1011602535789027331
;2018-06-25 17:30;2;4;"Is your financial institution technologically forward-thinking? Are you ready to deliver better customer experience with the help of technology? Here's what you need to know: https://goo.gl/RZnFNN pic.twitter.com/Gs3kOIUaag";;;;"1011240131573972992";https://twitter.com/NIITTech/status/1011240131573972992
;2018-06-25 14:47;0;0;"Does your Performance Management and Reporting System (PMRS) improve your customer's experience? Know how it can: https://goo.gl/xUNm5m # BFSI # PerformanceManagementpic.twitter.com/bmaGP5wHxl";;;# #;"1011199180520374272";https://twitter.com/NIITTech/status/1011199180520374272
;2018-06-24 17:30;0;2;"Discover how # insuretech can support # underwriting principle. Read the # blog by , @ JR_insurance our subject matter expert. https://goo.gl/39NfzR pic.twitter.com/DH3hgVelBn";;@;# # #;"1010877802307031042";https://twitter.com/NIITTech/status/1010877802307031042
;2018-06-23 17:30;0;1;"Can your products deliver intelligent decisions quickly without manual intervention? It's time for your company to grow beyond automation with # CognitiveComputing. https://goo.gl/5mFya6 pic.twitter.com/7KiCuHckVN";;;#;"1010515398108876801";https://twitter.com/NIITTech/status/1010515398108876801
;2018-06-22 16:23;0;4;"The rapid change in the ﬁnancial services industry has created a signiﬁcant impact on data management platforms. Read more: https://goo.gl/FuESrv # DataManagement # BFSIpic.twitter.com/M6MEAtCBoe";;;# #;"1010136102290776064";https://twitter.com/NIITTech/status/1010136102290776064
;2018-06-20 17:41;1;1;"Creating an exceptional user experience for HNW customers is critical. Here's how we enhanced efficiency for a # Financial # Investment Management company in revamping # wealth # data retrieval system. # BFSI https://goo.gl/FyGgjT pic.twitter.com/XOr6A54P9U";;;# # # # #;"1009431121283768320";https://twitter.com/NIITTech/status/1009431121283768320
;2018-06-19 18:01;2;3;"Through an # OpenBanking model, # PSD2 promises # CustomerService innovation and growth for banks by building a new partner-based ecosystem. Here's how in this blog @ suvrataa https://goo.gl/7o7r25 pic.twitter.com/kBAEUP3GZM";;@;# # #;"1009073721066360833";https://twitter.com/NIITTech/status/1009073721066360833
;2018-06-18 17:21;0;0;"# InstantApps are fast emerging as an exciting area of new # mobile experiences. Here’s how instant apps can extend reach for Developers and enhance experiences for Users.https://goo.gl/a1h6uY pic.twitter.com/SUQ4Fptdw1";;;# #;"1008701125158195201";https://twitter.com/NIITTech/status/1008701125158195201
;2018-06-17 17:54;0;0;"Does CRM Integration help optimize incident management and resolution? # CRM # BFSI Know more: https://goo.gl/joKKGq";;;# #;"1008347027460231168";https://twitter.com/NIITTech/status/1008347027460231168
;2018-06-17 17:51;1;1;"Banks can instantly deploy a core banking solution with comprehensive digital functionalities through # BankingEasy . Here’s how we enabled # digital transformation at mid-tier banks. https://goo.gl/vZLuuy pic.twitter.com/AlkuhpFwnS";;;# #;"1008346456456093698";https://twitter.com/NIITTech/status/1008346456456093698
;2018-06-16 08:54;1;2;"Wishing all of you # EidMubarakpic.twitter.com/hM47l0J5mL";;;#;"1007848859475857408";https://twitter.com/NIITTech/status/1007848859475857408
;2018-06-15 17:31;1;1;"We developed and used dynamic design with reusable tools to drastically reduce the effort involved in the consolidation process. Here's how: https://goo.gl/WpEZSR # BFSIpic.twitter.com/fJDBxI0Hzv";;;#;"1007616520732725249";https://twitter.com/NIITTech/status/1007616520732725249
;2018-06-14 17:52;1;5;"Moving from a legacy environment to a robust and agile accounting system is imperative for banks and financial services firms. Here's how we helped migrating unsupported accounting systems to supported environment for a premium US Investment Company. https://goo.gl/9FCWnY pic.twitter.com/HjMtA4uKvw";;;;"1007259373029081088";https://twitter.com/NIITTech/status/1007259373029081088
;2018-06-13 17:08;0;0;"Here‘s how our collaborative approach and unified global team helped deliver an ergonomic and modern user interface for a Financial Investment Management company. # UX # finance https://goo.gl/cpCoFp pic.twitter.com/kNqLw0IwRZ";;;# #;"1006885964336148480";https://twitter.com/NIITTech/status/1006885964336148480
;2018-06-13 11:39;1;3;"Collateral Management is no more just a set of process. With the changing regulatory environment, it has now become a core function. # BFSI https://goo.gl/wAfsrW pic.twitter.com/bRFHzO3VWS";;;#;"1006803213062942720";https://twitter.com/NIITTech/status/1006803213062942720
;2018-06-11 18:08;2;6;"Helping children lead a better and healthier life! Cheers to the NIIT Technologies’ SEI team for bringing joy and transformation to the lives of Government schools children in Jaganpur. # CSR # JoyofGivingpic.twitter.com/qsDXXGvhhV";;;# #;"1006176320831668225";https://twitter.com/NIITTech/status/1006176320831668225
;2018-06-10 18:11;1;6;"A day filled with Learning and lot of fun at Kasba Girls’ Home in Kolkata!! NIIT Technologies’ volunteers took 20 children on an educational tour to Indian Museum @ hopekfoundation. # CSRpic.twitter.com/S3yY8NSuOa";;@;#;"1005814628360884224";https://twitter.com/NIITTech/status/1005814628360884224
;2018-06-09 16:57;3;2;"We can meet the threat posed by # cyberattacks by incorporating best design and development practices at various levels to embed security into mobile apps from the ground up. Read how in this # blog by our expert, Rahul Arora. https://goo.gl/FaaEgY pic.twitter.com/NiOws9Sddl";;;# #;"1005433679865212928";https://twitter.com/NIITTech/status/1005433679865212928
;2018-06-08 17:45;3;3;"# Fintech firms can unlock great opportunities through # DataAnalytics and # AI technologies to drive # capitalmarkets investment. Read more in this # blog by @ suvrataa https://goo.gl/EH1nBt pic.twitter.com/r7vtkMNV4f";;@;# # # # #;"1005083446564143106";https://twitter.com/NIITTech/status/1005083446564143106
;2018-06-07 19:23;1;0;"Two revolutionary # digital solutions for # insurers and # reinsurers unveiling at # IASA2018. Here’s a precursor in this # blog by @ JR_insurance. https://goo.gl/GzFdpX pic.twitter.com/qHl9tk1Dp4";;@;# # # # #;"1004745652536918022";https://twitter.com/NIITTech/status/1004745652536918022
;2018-06-06 19:13;0;1;"It was a pleasure interacting with everyone at @ pega # PegaWorld2018. Here's something to take our # DigitalProcessTransformation conversation further. https://goo.gl/Mkko1N pic.twitter.com/08OU0VP4UM";;@;# #;"1004380872630415360";https://twitter.com/NIITTech/status/1004380872630415360
;2018-06-06 17:36;0;1;"Wondering how # Blockchain Integration can help deliver significant value to your customers? Let us explain. Meet our experts at Booth No. 13, @ pega # PegaWorld2018, 3rd to 6th June, Las Vegas. Digital https://goo.gl/Mkko1N pic.twitter.com/su27bMpU98";;@;# #;"1004356478457614336";https://twitter.com/NIITTech/status/1004356478457614336
;2018-06-05 19:30;4;3;"Powered by the digital strengths of @ IncessantTech & @ ruletekbpm, we have developed robust solutions to help companies with # Digital Process Transformation. Find out more at Booth #13 @ pega # PegaWorld2018, 3rd to 6th June, Las Vegas. https://goo.gl/Mkko1N pic.twitter.com/xyvbNuIKZf";;@ @ @;# #13 #;"1004022606180298757";https://twitter.com/NIITTech/status/1004022606180298757
;2018-06-05 18:00;1;2;"NIITians making the Earth a greener planet!! Tree plantation drive across our offices in Noida, Gr. Noida and Parwanoo!! # GoGreen # BeatPlastic # WorldEnvironmentDaypic.twitter.com/ecCWguMtV6";;;# # #;"1004000095182807040";https://twitter.com/NIITTech/status/1004000095182807040
;2018-06-05 17:55;2;2;"Here's a glimpse of LilNIITians performing on # WorldEnvironmentDay & NIITians sharing their unique ideas on embracing the changes for e-sustainability. Stay tuned for more. # GoGreenpic.twitter.com/TdONeS9Pup";;;# #;"1003998770437152768";https://twitter.com/NIITTech/status/1003998770437152768
;2018-06-05 17:15;1;6;". @ singh_sudhir12 shares the importance of smart # technology in # aviation in an interview with @ AVB_ME.https://goo.gl/fHs8Wd";;@ @;# #;"1003988706422738944";https://twitter.com/NIITTech/status/1003988706422738944
;2018-06-05 09:29;1;4;"e-Sustainability can bring in the much required long-term change for good of the planet. # GoGreen # WorldEnvironmentDaypic.twitter.com/XDXFwwbBoL";;;# #;"1003871351176941568";https://twitter.com/NIITTech/status/1003871351176941568
;2018-06-04 17:40;3;6;"Are you at @ pega # PegaWorld2018? Drop by at Booth No. 13 to discuss how your company can revolutionize customer experience with # Digital Process Transformation with us from 3rd to 6th June, Las Vegas. https://goo.gl/Mkko1N pic.twitter.com/rAywY56cqW";;@;# #;"1003632669668749313";https://twitter.com/NIITTech/status/1003632669668749313
;2018-06-03 17:53;0;5;"Meet us at booth no. #13 @ pega # PegaWorld 2018 to know about our Digital Process Transformation practice @ IncessantTech @ ruletekbpm https://goo.gl/MLAc79 pic.twitter.com/gcVY83naid";;@ @ @;#13 #;"1003273585992130560";https://twitter.com/NIITTech/status/1003273585992130560
;2018-06-02 15:12;2;3;". @ IncessantTech . @ ruletekbpm bring unmatched expertise in assisting global organizations to achieve their # digital process automation goals & revolutionize customer # experience # DigitalProcessTransformation https://goo.gl/MLAc79 pic.twitter.com/v2kEXY7e7P";;@ @;# # #;"1002870480204976128";https://twitter.com/NIITTech/status/1002870480204976128
;2018-06-01 17:42;2;1;"Our Digital Process Transformation Practice is powered by our two specialist subsidiaries @ IncessantTech @ ruletekbpm. Know More https://goo.gl/MLAc79 pic.twitter.com/tfhd4ggyYL";;@ @;;"1002545816807059456";https://twitter.com/NIITTech/status/1002545816807059456
;2018-05-31 18:04;2;1;"It is high time for banks to develop a seamless, integrated, consistent, & multi-/omni-channel experience for their consumers. Digital Foresight enables banks to deliver a personalized # digital # banking experience that exceeds customer expectations. https://goo.gl/swscQ3 pic.twitter.com/7C4Gzxux7F";;;# #;"1002189086826881024";https://twitter.com/NIITTech/status/1002189086826881024
;2018-05-30 17:35;2;0;"Building technology infrastructure and business systems to manage regulatory compliance are complex tasks. Here's how our domain expertise and a proven track record in mobilizing technology can help you match pace with the regulatory environment. https://goo.gl/SfrMuC pic.twitter.com/6tltPFTvbd";;;;"1001819496733134849";https://twitter.com/NIITTech/status/1001819496733134849
;2018-05-29 17:51;0;2;"What does it take to solve the complex reconciliation challenges? Find out. # Blockchain https://goo.gl/bD3zyn pic.twitter.com/qAkeqbOZGW";;;#;"1001460915978387456";https://twitter.com/NIITTech/status/1001460915978387456
;2018-05-28 17:11;4;2;"Is your financial services company losing customers due to generalization? Here's something you need to know. # Finance # Personalization https://goo.gl/zGXLvm pic.twitter.com/TEFNk8FjQo";;;# #;"1001088545627385856";https://twitter.com/NIITTech/status/1001088545627385856
;2018-05-27 17:00;1;4;"Underwriting has evolved from a process-driven model to focusing on the end-user experience. Here’s how we can help optimize the @ DuckCreekTech’s User Experience from Implementation to Long-Term Sustainability. https://goo.gl/Akoi9V pic.twitter.com/aRTF54I0F5";;@;;"1000723430101209088";https://twitter.com/NIITTech/status/1000723430101209088
;2018-05-26 17:00;4;5;". @ rstormonth, Executive Vice President, Research, at @ NHInsight, shares her take on NIIT Technologies' growth trajectory and focus areas. https://goo.gl/NQZNAQ pic.twitter.com/HPmShkhv3P";;@ @;;"1000360969032388609";https://twitter.com/NIITTech/status/1000360969032388609
;2018-05-25 17:37;1;1;"Can your products deliver intelligent decisions quickly without manual intervention? It's time for your company to grow beyond automation with # CognitiveComputing. https://goo.gl/5mFya6 pic.twitter.com/jfmKtSv8jq";;;#;"1000007973614358528";https://twitter.com/NIITTech/status/1000007973614358528
;2018-05-24 17:30;3;1;"Take your margins a step further with # CognitiveComputing. Know how to get at the crux of effective claims management and higher margins in this # whitepaper https://goo.gl/7MKCcE pic.twitter.com/IYeCGHQVtL";;;# #;"999643857179602945";https://twitter.com/NIITTech/status/999643857179602945
;2018-05-23 17:21;1;1;"Many issues and technical challenges pop up when migrating from one Mainframe based compiler to another. We helped a client in such a case and enabled flawlessly smooth migration. Know more. # APIMigration https://goo.gl/tWKJDa pic.twitter.com/t6uxjiN0iZ";;;#;"999279190460510209";https://twitter.com/NIITTech/status/999279190460510209
;2018-05-22 18:09;2;3;"Data Analytics now stands at the core of every product and service that's going digital. Here's what you need to know before you start the Digital Transformation of your business. Read more about it in this blog by Sandeep Raut, our subject matter expert: https://goo.gl/sWpYdk pic.twitter.com/rGhWXTX0nE";;;;"998928757841956864";https://twitter.com/NIITTech/status/998928757841956864
;2018-05-19 19:09;3;8;"# GDPR triggers new opportunities: Mandating compliance with trust and transparency as the new drivers. Read more in this # blog by Dr. Jitendra Mohan Bhardwaj, our subject matter expert. https://goo.gl/DkNA2e pic.twitter.com/nucVlXi3mo";;;# #;"997856684415561731";https://twitter.com/NIITTech/status/997856684415561731
;2018-05-18 17:00;2;4;"Stuck with stagnation in your # Insurance business? Reinvent and Regrow with # CognitiveComputing. Know how in this # blog by Vikram Singh, our subject matter expert. https://goo.gl/rxnNRk pic.twitter.com/QZ5FYGN9UN";;;# # #;"997461985422954496";https://twitter.com/NIITTech/status/997461985422954496
;2018-05-17 19:30;1;3;"Here’s a sneak peek into our Europe Analyst & Advisor Day. # NTLARpic.twitter.com/yNcQCh7HQK";;;#;"997137317403025409";https://twitter.com/NIITTech/status/997137317403025409
;2018-05-17 16:43;1;2;"Discover how insuretech can support underwriting principle. Read the blog by @ JR_insurance, our subject matter expert. https://goo.gl/39NfzR pic.twitter.com/vVr8pk0oFZ";;@;;"997095310123044864";https://twitter.com/NIITTech/status/997095310123044864
;2018-05-17 03:00;1;4;"Thank you for joining us at the @ DuckCreekTech Formation18 and making the event a success! Know more about our # DuckCreek offerings on https://goo.gl/w2dwrU # Formation18pic.twitter.com/f2So5b7k4c";;@;# #;"996888134322458640";https://twitter.com/NIITTech/status/996888134322458640
;2018-05-16 01:00;0;4;"Are you at Formation18? Don't miss out our sponsored event, Universal CityWalk™ Block Party on 15th May night ! It is going to be exciting. Join the conference from 14th to 16th May, Orlando, Florida. # Formation18 https://goo.gl/TCo3R3 pic.twitter.com/4HvAtxiMEa";;;#;"996495527268188165";https://twitter.com/NIITTech/status/996495527268188165
;2018-05-15 21:46;2;8;"Thank you everyone for joining us at the Europe Analyst and Advisor Forum. To know more about our services, visit: https://goo.gl/sGH4cx # NTLRpic.twitter.com/5f9vRtYPLl";;;#;"996446783982133248";https://twitter.com/NIITTech/status/996446783982133248
;2018-05-15 20:00;0;4;"You can't miss this exciting panel on @ DuckCreekTech learnings on 15th May at 10:30 AM EDT at Formation18! Hope to see you there. # Formation18 https://goo.gl/TCo3R3 pic.twitter.com/DPtJyTve2P";;@;#;"996420094359228416";https://twitter.com/NIITTech/status/996420094359228416
;2018-05-15 18:48;0;2;"# Transformation with # IntelligentAutomation : an exciting session from Madan Mohan, our Global Head of Data and Automation, at the Europe Analyst and Advisor Forum, is going to be insightful! # NTLARpic.twitter.com/dDJuTWafK0";;;# # #;"996401845785378822";https://twitter.com/NIITTech/status/996401845785378822
;2018-05-15 18:04;0;0;"Our Global Head of Insurance, Anurag Chauhan sharing an update on our # Insurance Vertical at the Europe Analyst and Advisor Forum today. See you there. # NTLARpic.twitter.com/u96D8FBEVt";;;# #;"996390940632743936";https://twitter.com/NIITTech/status/996390940632743936
;2018-05-15 17:51;1;1;"Our Global Head of # BFS & Head of Europe, . @ gsamanta123 providing FY18 update for Europe market and # BFS & # Travel & Transportation verticals at the Europe Analyst and Advisor Forum. # NTLARpic.twitter.com/8LSuJIzKHX";;@;# # # #;"996387637387653121";https://twitter.com/NIITTech/status/996387637387653121
